asset_slug,title,category,subcategory,status,lifecycle_reason,lifecycle_date,successor_asset_slug,consumer_guidance,access_tier,owner,update_cadence,canonical_path,canonical_format,available_formats,metadata_paths,localized_name_locales,localized_name_review_states,has_pmtiles,has_geojson,has_csv,source,license,citation,notes
natural-earth-10m-land,Natural Earth 10m Land,100-geographic-reference,110-boundaries,active,,,,,public,SkyTruth,manual,gs://skytruth-shared-datasets-1/100-geographic-reference/110-boundaries/natural-earth-10m-land/latest/natural-earth-10m-land.fgb,fgb,fgb;pmtiles,README.md;runs/YYYY-MM-DD.json,,,true,false,false,"Natural Earth 1:10,000,000 physical land polygons v5.1.1",Public domain per Natural Earth Terms of Use,Made with Natural Earth. Free vector and raster map data at naturalearthdata.com; land polygons version 5.1.1.,"Initial upload from local Natural Earth ne_10m_land shapefile version 5.1.1; release 2026-04-30; source features 11; fgb sha256 5e69cd50432794b6411a81d99faa1d1c74e9d778fbfd430e43e1c7adb4d9912a; pmtiles sha256 52793c9fd15c17777a271cb3f984d8a3ffee8acb7c25a8aa04b8809d458901be; PMTiles rebuilt 2026-05-04 with zooms 0-8, no pre-tiling simplification, no line simplification, and no tiny-polygon reduction at maximum zoom for higher-zoom display fidelity; future rebuilds must use the repo-standard GeoJSONSeq to Tippecanoe MBTiles to PMTiles conversion path; canonical FGB preserves source geometry and fields; metadata-contract release 2026-06-05 was built from the unchanged 2026-04-30 release FGB and adds generated geometry-digest feature_id values, legacy non-URL-safe ext_id values, feature_hash values, canonical metadata/schema/manifest artifacts, and metadata-lookup PMTiles with only feature_id and ext_id; fgb sha256 fba2554abe0e0d55eb79095538782b6691200950400ad258f418b84286461032; pmtiles sha256 45bc4178050c3704efe75381477ab2b829c389488e2573685b72c087d6c5e28b; metadata sha256 2111661d1b0b43247e8d47771a79b3d49541f1f1c4d40f269fe14ef31dd4f030; schema sha256 05c1c4ab87d2fef7195fe140ece38371acb41340dee2779360b221dadb816a48; manifest sha256 1c0bb60bba5c5432274f0c68d54ed5bb374e95518488b5559267444c636f6ce4"
iho-world-seas,IHO World Seas,100-geographic-reference,120-marine-boundaries,active,,,,,public,SkyTruth,manual,gs://skytruth-shared-datasets-1/100-geographic-reference/120-marine-boundaries/iho-world-seas/latest/iho-world-seas.fgb,fgb,fgb;pmtiles,README.md;runs/YYYY-MM-DD.json,,,true,false,false,Marine Regions World Seas IHO v3,See source terms,"Flanders Marine Institute (2018). IHO Sea Areas, version 3. Available online at https://www.marineregions.org/. https://doi.org/10.14284/323.","Initial upload from iho-mr_World_Seas_IHO_v3.fgb; release 2026-04-29; sha256 1fb5a7988b686e1076fe0a21d75d5df32fa28dfcd100dbe3db3aaaf8c9493ba6; PMTiles sha256 0d0985cf36ad244215f80bf198dcc43eaef1767bdd9e580f07062391d273f51b; PMTiles rebuilt 2026-05-04 at maxzoom 12 from sampled FGB geometry detail with local tile and browser QA. The 2026-06-05 reviewed metadata-contract release uses MRGID as the selected provider identifier, adds feature_id, ext_id, feature_hash, metadata/schema/manifest artifacts, and keeps the 2026-04-29 release readable and unchanged. No shared_datasets_group_id, shared_datasets_row_id, or localized metadata sidecars are generated. PMTiles are metadata-lookup tiles with feature_id and ext_id only. Release history, source generations, row counts, and hashes are recorded in the bucket release index and per-run record."
wdpa-marine,WDPA Marine Protected and Conserved Areas,100-geographic-reference,130-protected-areas,active,,,,,public,SkyTruth,monthly,gs://skytruth-shared-datasets-1/100-geographic-reference/130-protected-areas/wdpa-marine/latest/wdpa-marine.fgb,fgb,fgb;pmtiles,README.md;runs/YYYY-MM-DD.json,,,true,false,false,UNEP-WCMC and IUCN Protected Planet WDPA/WDOECM,See Protected Planet WDPA terms,"UNEP-WCMC and IUCN (2026). Protected Planet: The World Database on Protected Areas (WDPA) and World Database on Other Effective Area-based Conservation Measures (WD-OECM) [Online], June 2026, Cambridge, UK: UNEP-WCMC and IUCN. Available at: www.protectedplanet.net.","Monthly job preserves source fields and publishes FGB plus PMTiles. The 2026-06-05 reviewed metadata-contract release adds provider feature_id values from SITE_PID, legacy non-URL-safe ext_id values, feature_hash values, canonical metadata/schema/manifest artifacts, and an initial Spanish NAME_ENG metadata sidecar generated from the metadata-translations CSV. PMTiles are lightweight metadata-lookup tiles with feature_id and ext_id only. The release preserves 331 upstream invalid geometries from the current FGB; no geometry repair was applied. Release history, source versions, row counts, and file hashes are recorded in the bucket release index and per-run records."
wdpa-terrestrial,WDPA Terrestrial Protected and Conserved Areas,100-geographic-reference,130-protected-areas,active,,,,,public,SkyTruth,monthly,gs://skytruth-shared-datasets-1/100-geographic-reference/130-protected-areas/wdpa-terrestrial/latest/wdpa-terrestrial.fgb,fgb,fgb;pmtiles,README.md;runs/YYYY-MM-DD.json,,,true,false,false,UNEP-WCMC and IUCN Protected Planet WDPA/WDOECM,See Protected Planet WDPA terms,"UNEP-WCMC and IUCN (2026). Protected Planet: The World Database on Protected Areas (WDPA) and World Database on Other Effective Area-based Conservation Measures (WD-OECM) [Online], June 2026, Cambridge, UK: UNEP-WCMC and IUCN. Available at: www.protectedplanet.net.","Monthly job preserves source fields and publishes FGB plus PMTiles. The 2026-06-05 reviewed metadata-contract release adds provider feature_id values from SITE_PID, legacy non-URL-safe ext_id values, feature_hash values, canonical metadata/schema/manifest artifacts, and an initial Spanish NAME_ENG metadata sidecar generated from the metadata-translations CSV. PMTiles are lightweight metadata-lookup tiles with feature_id and ext_id only. The release preserves 2,661 upstream invalid geometries from the current FGB; no geometry repair was applied. Release history, source versions, row counts, and file hashes are recorded in the bucket release index and per-run records."
cerulean-s1-envelope,Cerulean S1 Envelope,200-imagery-derived,210-satellite-indexes,active,,,,,public,SkyTruth,manual,gs://skytruth-shared-datasets-1/200-imagery-derived/210-satellite-indexes/cerulean-s1-envelope/latest/cerulean-s1-envelope.fgb,fgb,fgb;pmtiles,README.md;runs/YYYY-MM-DD.json;latest/cerulean-s1-envelope.metadata.ndjson.gz;latest/cerulean-s1-envelope.schema.json;latest/cerulean-s1-envelope.manifest.json,,,true,false,false,SkyTruth internal derived Cerulean Sentinel-1 envelope WKT extract,SkyTruth internal use; upstream source and redistribution terms need confirmation,SkyTruth (2026). Cerulean S1 Envelope. Internal derived Sentinel-1 envelope extract; upstream source citation needs confirmation.,"Named as a Cerulean envelope to avoid implying complete Sentinel-1 footprint coverage; the legacy remote prefix sentinel-1-footprints is a deprecated pre-rename location and is intentionally not an active catalog slug; release 2026-05-01; source features 1; fgb sha256 4fd635807aa544d8a0019f54ff663a639816cc7b2726d7a935fb7d8780924b11; pmtiles sha256 33f080e73a6ea2f5dc78b7174abbaf61c6d3c52165615f69ff1d8510ac225e6d; PMTiles rebuilt 2026-05-04 with zooms 0-6, no simplification, and synthetic source_layer property for catalog inspection; corrective metadata-contract release 2026-06-05 reuses latest FGB generation 1777669295802653, adds generated feature_id, legacy non-URL-safe ext_id, feature_hash, metadata sidecar, schema, manifest, and metadata-lookup PMTiles with only feature_id and ext_id; fgb sha256 94520e1987bc4f84e253218c6467b1ddeb1b5ad4b59b17fba2ac037a935966ac; pmtiles sha256 825cb5d5142ce63752d71ec43e76098506c3cf07c683a4032d4c0fe00dd52fab; metadata sha256 af34ee531b4404337b773107376b7d8c8cee4662b4b08992c59abdebddb492d6; schema sha256 c0a8f1b1f6916ff8488d5e1802cfafb1ef44ff3d63d4113f07a80df6eab6ea18; manifest sha256 ab2dd57bb04704512d5493d6f734487c78a5805d6d9d70beebdf8e6654504dd7; canonical FGB preserves the source WKT geometry as an envelope only"
ims-sea-ice-extent,IMS Sea-Ice Extent,200-imagery-derived,250-weather-climate,active,,,,,public,SkyTruth,daily,gs://skytruth-shared-datasets-1/200-imagery-derived/250-weather-climate/ims-sea-ice-extent/latest/ims-sea-ice-extent.fgb,fgb,fgb;pmtiles,README.md;runs/YYYY-MM-DD.json,,,true,false,false,NOAA/NSIDC IMS Daily Northern Hemisphere Snow and Ice Analysis G02156,Public U.S. government work; cite NSIDC G02156,"U.S. National Ice Center (2008). IMS Daily Northern Hemisphere Snow and Ice Analysis at 1 km, 4 km, and 24 km Resolutions, Version 1. Boulder, Colorado USA: National Snow and Ice Data Center. https://doi.org/10.7265/N52R3PMC. Accessed 2026-05-07.","Daily job publishes raw IMS class 3 as FGB plus PMTiles. The 2026-06-05 metadata-contract refresh release was built from the unchanged 2026-06-03 latest FGB and adds generated feature_id/feature_hash fields, a metadata sidecar, release schema, manifest, and lightweight lookup PMTiles. Release history, source versions, row counts, and file hashes are recorded in the bucket release index and per-run records."
gogi,Global Oil & Gas Features Database,300-infrastructure-industrial,310-energy,active,,,,,public,SkyTruth,manual,gs://skytruth-shared-datasets-1/300-infrastructure-industrial/310-energy/gogi/latest/gogi-pipelines.fgb,fgb,fgb;csv;pmtiles,README.md,,,true,false,true,NETL EDX Global Oil & Gas Features Database gogi_v10_3_1shp.zip,Creative Commons Attribution and Open Data Commons Attribution License; attribution required,"Sabbatino, M., Romeo, L., Baker, V., Bauer, J., Barkhurst, A., Bean, A., DiGiulio, J., Jones, K., Jones, T.J., Justman, D., Miller III, R., Rose, K., and Tong, A. Global Oil & Gas Features Database. Energy Data eXchange, 2017-12-12. https://doi.org/10.18141/1427300.","Initial upload from gogi_v10_3_1shp.zip; release 2026-05-02; source zip sha256 2621f210dde27f068ea2987e0cf0135b20c2641e94e6b4e3692ac9ee4263ad07; 17 source shapefile layers converted to WGS84 FGB plus 2 combined CSV catalog tables; retained 1,623,469 vector features after omitting 394 well points that could not be reprojected; Well.dbf is truncated in the source shapefile resource, so wells are published as geometry only; pmtiles sha256 9fe9a4705b06ae08327e59b769b06ffe16d1d7f6932b0b318bbe92055be8ab31; PMTiles rebuilt 2026-05-04 at maxzoom 12 as multi-layer display tiles with compact feature properties and low-zoom point retention; future rebuilds must use the repo-standard GeoJSONSeq to Tippecanoe MBTiles to PMTiles conversion path"
petrodata,PETRODATA Petroleum Fields,300-infrastructure-industrial,310-energy,active,,,,,public,SkyTruth,manual,gs://skytruth-shared-datasets-1/300-infrastructure-industrial/310-energy/petrodata/latest/petrodata.fgb,fgb,fgb;pmtiles,README.md,,,true,false,false,PRIO PETRODATA v1.2,"No explicit license found on the PRIO dataset page; cite Lujala, Rod, and Thieme 2007 and follow source terms","Lujala, Paivi, Jan Ketil Rod, and Nadja Thieme (2007). Fighting over Oil: Introducing a New Dataset. Conflict Management and Peace Science 24(3): 239-256. https://doi.org/10.1080/07388940701468526.","Combined local onshore and offshore shapefiles into one FGB plus PMTiles with source_layer; release 2026-04-29; fgb sha256 d77f5e4bdb9d231a9058e70c03648092a613c5009889d5f57e0ae05969950296; pmtiles sha256 798ea67f06e20c7912b441cf0a6b3eb5ceee9063d9f164c9e57daacd737741a7; corrective release 2026-05-06 repaired geometry with GDAL -makevalid while preserving duplicate source PRIMKEY rows; fgb sha256 b2a19482a325dc7eae3f91f1ededcf586531dcee04272239c4ca210d23fa358b; pmtiles sha256 e3fb9bf85f023e316438ba1ef3a8ca78182b541d37b23eeede69346272e1af22; corrective release 2026-06-05 adds generated feature_id values, legacy non-URL-safe ext_id values, feature_hash values, canonical metadata/schema/manifest artifacts, a machine-translated Spanish NAME metadata sidecar, and metadata-lookup PMTiles with only feature_id and ext_id; fgb sha256 e2ac998e9b82a017667d24cfc8096ac29e658d07605863fe764106e214b016bd; pmtiles sha256 b25cd901930fedb1fe8a5ac2ac517ddf80f89739eeccad504db57f4568f54ffe; metadata sha256 703d29b548a1941d6a63dde4754be3140909f430df12295ed2852af424b9a42d; metadata.es sha256 34bd03d5d67a4670835219fa1a9b1d31c635e84da2b0ef34d90db7f06e1736e5; metadata-translations sha256 762d0eb6d2063690f7091ab8bb28a5283965e2ee4240a1b20b1260ec90615265; schema sha256 18b8182a5ffae1758647cb874933a7c0788f0e6cb7c7e4b0ebb09c24679b2739; manifest sha256 0e4b58d68693e17e612ddabb352e127aa9b755693dd61e553da65e06d56189b6; PMTiles maxzoom 9 preserved from the existing published PETRODATA PMTiles because this remediation changes metadata lookup fields rather than source scale"
eamlis-abandoned-mine-land-inventory,OSMRE e-AMLIS Abandoned Mine Land Inventory,300-infrastructure-industrial,320-mining,active,,,,,public,SkyTruth,monthly,gs://skytruth-shared-datasets-1/300-infrastructure-industrial/320-mining/eamlis-abandoned-mine-land-inventory/latest/eamlis-abandoned-mine-land-inventory.fgb,fgb,fgb;pmtiles,README.md;runs/YYYY-MM-DD.json,,,true,false,false,U.S. Department of the Interior OSMRE e-AMLIS,Creative Commons Attribution per EDX listing; cite OSMRE e-AMLIS,"U.S. Department of the Interior, Office of Surface Mining Reclamation and Enforcement. Enhanced Abandoned Mine Land Inventory System (e-AMLIS). https://amlis.osmre.gov/.","Monthly job publishes FGB plus PMTiles. The 2026-06-05 reviewed metadata-contract release adds provider feature_id values from OBJECTID, legacy non-URL-safe ext_id values, feature_hash values, canonical metadata/schema/manifest artifacts, and an initial Spanish PA_NAME metadata sidecar generated from the metadata-translations CSV. PMTiles are lightweight metadata-lookup tiles with feature_id and ext_id only. Release history, source fingerprints, row counts, and file hashes are recorded in the bucket release index and per-run records. Stale initial GeoJSON remains only under source/provenance paths and is not advertised as an active data-plane format."
gfw-fixed-infrastructure,Global Fishing Watch SAR Fixed Infrastructure,300-infrastructure-industrial,330-offshore-platforms,active,,,,,public,SkyTruth,manual,gs://skytruth-shared-datasets-1/300-infrastructure-industrial/330-offshore-platforms/gfw-fixed-infrastructure/latest/gfw-fixed-infrastructure.fgb,fgb,fgb;pmtiles,README.md,,,true,false,false,Global Fishing Watch Datasets API public-fixed-infrastructure-filtered:latest,Global Fishing Watch API non-commercial use only and subject to Global Fishing Watch Terms of Use,"Global Fishing Watch (2026). Fixed infrastructure detections from Sentinel-1 and Sentinel-2, public-fixed-infrastructure-filtered:latest; derived from Paolo, F.S. et al. (2024). Satellite mapping reveals extensive industrial activity at sea. Nature 625: 85-91. https://doi.org/10.1038/s41586-023-06825-8.",Initial upload from gfw_infra_2026-04-30; release 2026-04-30; source rows 57681; fgb sha256 159af982d72f464091c06e68de6abe054a5c07ae05ff4731c8cb041979fb3447; pmtiles sha256 c2a3c96f98ef38a8ac1db217b8d42008d0c4c874581947e84a6c59521839ff1e; PMTiles rebuilt 2026-05-04 at maxzoom 12 with all-point retention verified at zoom 0 for all 57681 points; future rebuilds must use the repo-standard GeoJSONSeq to Tippecanoe MBTiles to PMTiles conversion path; source csv sha256 07d8d7464c7c2d7410926d2a29c24eb2d2aa2993c2b576a138ce0c57111cf1a9
acled-europe-central-asia-aggregated-weekly-admin1,ACLED Europe and Central Asia Weekly Admin 1 Aggregated Events,400-events-observations,430-alerts-notices,active,,,,,private,SkyTruth,manual,gs://skytruth-shared-datasets-1/400-events-observations/430-alerts-notices/acled-europe-central-asia-aggregated-weekly-admin1/latest/acled-europe-central-asia-aggregated-weekly-admin1.fgb,fgb,fgb;pmtiles,README.md;runs/YYYY-MM-DD.json,,,true,false,false,ACLED aggregated data for Europe and Central Asia,ACLED Terms and Conditions; private internal shared-datasets use confirmed by SkyTruth authorization on 2026-05-08,"ACLED (Armed Conflict Location & Event Data), aggregated data for Europe and Central Asia, accessed 2026-05-08, up to week of 2026-04-25, https://acleddata.com/aggregated/aggregated-data-europe-and-central-asia.","Manual private snapshot from ACLED weekly aggregated Europe and Central Asia XLSX export; release 2026-04-25; 120245 point features. The 2026-06-05 same-release metadata-contract repair reused the current release FGB as the authoritative source, added composite provider feature_id values, legacy non-URL-safe ext_id values, feature_hash values, canonical metadata/schema/manifest artifacts, and metadata-lookup PMTiles with only ext_id and feature_id properties. No shared_datasets_group_id, shared_datasets_row_id, or localized metadata sidecars are generated for this private repair. FGB sha256 678ed880838379c2830ce2a55774500bb3c68ef5e99836a6b546f8b910daf400; PMTiles sha256 e3adf3e282679521fb1a4bd9db3f2b5c26ce7e90c3416324c0588ff5993528ed; metadata sidecar sha256 f2601a68c2dc714443175b217dd414a5a571aad8e8c215cf1feb750094dd47d1; schema sha256 9a5c85f2eadc61d86379bf8bbc06a209bb6176ecfd36a4969cb50fa044178438; manifest sha256 1abe0a50205976e81b88a57f5f86632c35a85006b3732a3a26c1a5754013f4ec. PMTiles maxzoom 12 with all-point retention verified at zoom 0."
acled-middle-east-aggregated-weekly-admin1,ACLED Middle East Weekly Admin 1 Aggregated Events,400-events-observations,430-alerts-notices,active,,,,,private,SkyTruth,manual,gs://skytruth-shared-datasets-1/400-events-observations/430-alerts-notices/acled-middle-east-aggregated-weekly-admin1/latest/acled-middle-east-aggregated-weekly-admin1.fgb,fgb,fgb;pmtiles,README.md,,,true,false,false,ACLED aggregated data for Middle East,ACLED Terms and Conditions; private internal shared-datasets use confirmed by SkyTruth authorization on 2026-05-08,"ACLED (Armed Conflict Location & Event Data), aggregated data for Middle East, accessed 2026-05-12, up to week of 2026-05-02, https://acleddata.com/aggregated/aggregated-data-middle-east.",Manual private snapshot from ACLED weekly aggregated Middle East XLSX export; release 2026-05-02; 147190 point features; fgb sha256 b26a3d53c1d0dbe4f3f16715002b7b3751bafc4321c7b435170e581c96ebac79; pmtiles sha256 ab55ed31434042157036006e9524d30327f100e226361d654d0bc23a8f131464; PMTiles maxzoom 12 with all-point retention verified at zoom 0; future rebuilds must use the repo-standard GeoJSONSeq to Tippecanoe MBTiles to PMTiles conversion path.
global-coral-reefs,Global Distribution of Coral Reefs,500-conservation-ecosystems,530-habitat-condition,active,,,,,private,SkyTruth,manual,gs://skytruth-shared-datasets-1/500-conservation-ecosystems/530-habitat-condition/global-coral-reefs/latest/global-coral-reefs.fgb,fgb,fgb;pmtiles,README.md;runs/YYYY-MM-DD.json;latest/global-coral-reefs.metadata.ndjson.gz;latest/global-coral-reefs.schema.json;latest/global-coral-reefs.manifest.json,,,true,false,false,"UNEP-WCMC, WorldFish Centre, WRI, and TNC Global Distribution of Coral Reefs v4.1",UNEP-WCMC General Data License (excluding WDPA); contextual internal use with citation only; no redistribution without permission,"UNEP-WCMC, WorldFish Centre, WRI, TNC (2021). Global distribution of coral reefs, compiled from multiple sources including the Millennium Coral Reef Mapping Project. Version 4.1, updated by UNEP-WCMC. Cambridge (UK): UN Environment Programme World Conservation Monitoring Centre. https://doi.org/10.34892/t2wk-5t34.","Converted local polygon and point shapefiles to FGB plus PMTiles with both layers; release 2026-04-29; polygon fgb sha256 387d9999983a2cf9916ce3d7d496c45319ed8196eccfe9b3d2e8622b82756869; point fgb sha256 a81fcf8264e397fe08cd2655ad580cf36da6fea6010e830b97947fb091bb8ccf; pmtiles sha256 2e33c2bbbf0942d0b692e663815177c47f87a008a5206451e0e293f8af82b7b6; metadata-contract release 2026-06-05 changes the active canonical contract from polygon-only to a mixed polygon+point FGB containing 17,504 polygon features and 925 point features. The release adds generated feature_id values, legacy non-URL-safe ext_id values derived from those internal IDs, feature_hash values, geometry_role, canonical metadata/schema/manifest artifacts, and metadata-lookup PMTiles with only feature_id and ext_id. No shared_datasets_group_id, shared_datasets_row_id, or localized metadata sidecar is generated for this release. fgb sha256 843a00eb56572d2b6b42ef21a67fe01899b212348c236fda14537f460d895c63; point fgb sha256 c9c0e12cad445c29e08de4767866332bee09898600736e668aabf682649976c3; pmtiles sha256 def9354c709e14aaae1085f178bba37f753817d43926d1f12d557ddb717b8674, corrected 2026-06-06 with Tippecanoe drop-rate 1 after verifying all 925 point features decode at zoom 0; metadata sha256 479f8defa534da8016e665f488293c5fd9628c148c1f634e501583e165f74f36; schema sha256 0c59dffa6d785fc3f7b6b1fd6a875b5712e135bf134b470e87f51e857e717547; corrective 2026-06-06 release replaces the legacy ext_id handles with generated URL-safe decimal sequence handles 1 through 18429 while preserving feature_id and feature_hash values. Corrective release artifact hashes before promotion finalization are fgb 474498fdc17bc83afe3c70dfb2475dacec32747f29e6139741b4c3d838e0d713; point fgb cfdff78a343cd9cb177ecfac8f1a265850408360b1750fac6cb92137b28e4c2d; pmtiles c6078a4bbb23bdd25ac2bb8283b7a5b1d383f36d4060cf3a54fcf1ffacdc6936; metadata 8d90c2f7d4de274d2f24f2e99ec1f4fa8db66edfdb321e3f9e948c289c4332dc; schema 319351fb6b07f5d74b886b097ed74252dd03e0635ef217062840bb0155454331. Finalized manifest checksum is recorded in the release run record after promotion."
iucn-mammal-ranges,IUCN Red List Mammal Range Maps,500-conservation-ecosystems,530-habitat-condition,active,,,,,private,SkyTruth,manual,gs://skytruth-shared-datasets-1/500-conservation-ecosystems/530-habitat-condition/iucn-mammal-ranges/latest/iucn-mammal-ranges.fgb,fgb,fgb;pmtiles,README.md,,,true,false,false,"IUCN Red List of Threatened Species spatial data, mammals group, Red List version 2025-2 / metadata v6.3","IUCN Red List Terms and Conditions of Use v3.1; non-commercial conservation, education, scientific analysis, and research use only; no reposting or redistribution without prior written permission from IUCN","IUCN (2025). The IUCN Red List of Threatened Species. Version 2025-2. https://www.iucnredlist.org. Accessed 2026-05-02. For species-level map use, cite the source feature-level citation values.",Initial private upload from local MAMMALS.zip; release 2026-05-02; source zip sha256 4f58134883e2cbb2d242170438eb3a2158a53e95782d25881212b87c1d9daaa2; source shapefile parts MAMMALS_PART1 and MAMMALS_PART2 each contained 6619 features; combined output rows 13238; fgb sha256 f8330ab5daf019a5862dee65af4c43827a9832ef0f17c01afc8928eb8027f20b; pmtiles sha256 c159527b50d5205612663ce48922617abbd2a1ffb3dd87e2bed6358ac3be2c52; PMTiles display artifact uses maxzoom 6 and tile-simplify 0.01; future rebuilds must use the repo-standard GeoJSONSeq to Tippecanoe MBTiles to PMTiles conversion path; canonical FGB preserves source fields and adds source_part; raw zip not uploaded because zip is not an approved source/archive format and IUCN terms restrict reposting/redistribution
iucn-reptile-ranges,IUCN Red List Reptile Range Maps,500-conservation-ecosystems,530-habitat-condition,active,,,,,private,SkyTruth,manual,gs://skytruth-shared-datasets-1/500-conservation-ecosystems/530-habitat-condition/iucn-reptile-ranges/latest/iucn-reptile-ranges.fgb,fgb,fgb;pmtiles,README.md,,,true,false,false,"IUCN Red List of Threatened Species spatial data, reptiles group, Red List version 2025-2 / metadata v6.3","IUCN Red List Terms and Conditions of Use v3.1; non-commercial conservation, education, scientific analysis, and research use only; no reposting or redistribution without prior written permission from IUCN","IUCN (2025). The IUCN Red List of Threatened Species. Version 2025-2. https://www.iucnredlist.org. Accessed 2026-05-03. For species-level map use, cite the source feature-level citation values.",Initial private upload from local REPTILES.zip; release 2026-05-03; source zip sha256 68bf0ca138044a91dcfa301eda1ed9eb9c2b19f5b668c8e7ed1f281877ba4bbd; source shapefile parts REPTILES_PART1 and REPTILES_PART2 each contained 7026 features; combined output rows 14052; fgb sha256 4c9020a8b138cdc5247c67ed71b29ef478df2c274aa6f05c1d76d1f49ce66bc2; pmtiles sha256 aabaf0360d767b892c020ccac85eb9ba0df1998280f9b2c40066e28b535db7eb; PMTiles display artifact uses maxzoom 6 and tile-simplify 0.01; future rebuilds must use the repo-standard GeoJSONSeq to Tippecanoe MBTiles to PMTiles conversion path; canonical FGB preserves source fields and adds source_part; raw zip not uploaded because zip is not an approved source/archive format and IUCN terms restrict reposting/redistribution
